{
  "created_at": "2026-10-18T10:27:14Z",
  "environment": {
    "awen_native": "0.1.0",
    "numpy": "2.5.4",
    "python": "3.13.5",
    "torch": "2.14.1+cpu"
  },
  "evidence_policy": "cpu/cuda rows are measured on the recorded hardware. awen-reference, photonic-sim and hybrid rows time the simulator on this host; their accuracy is simulated. No row is a photonic hardware measurement.",
  "evidence_sha256": "sha256:b65a849f9579758731cd00fdd1eea9b320c7b51894c7a904e8314343792a33f1",
  "git": {
    "dirty": false,
    "sha": "d9ade4ca0b63169c3f0cbe2ca6dafedffbf671f4"
  },
  "hardware": {
    "cpu_count": 8,
    "cpu_model": "Intel(R) Xeon(R) Processor",
    "cuda_available": false,
    "load_average_1_5_15": [
      3.74,
      2.78,
      3.17
    ],
    "machine": "x86_64",
    "mem_total_kib": 16386368,
    "platform": "Linux-6.12.94+-x86_64-with-glibc2.41",
    "torch_threads": 8
  },
  "label": "box CPU (Intel Xeon, 8 vCPU, no GPU)",
  "results": [
    {
      "backend": "cpu",
      "fidelity": "measured",
      "latency": {
        "mean_ms": 4.280203589878511,
        "median_ci95_ms": [
          0.011889260804309748,
          6.530288002977613
        ],
        "min_ms": 0.008624003385193646,
        "p50_ms": 0.013921999197918922,
        "p95_ms": 8.403705203090794,
        "p99_ms": 13.108827400574585,
        "run_median_ci95_ms": [
          0.011552200157893822,
          6.034176798857516
        ],
        "run_median_mean_ms": 3.004632599913748,
        "runs": 5,
        "samples": 100
      },
      "process_max_rss_mib": 237.8203125,
      "relative_rms_error_vs_fp64": {
        "max": 5.118583075552479e-08,
        "mean": 5.11858307555248e-08
      },
      "shape_mkn": [
        64,
        128,
        128
      ],
      "status": "ok",
      "throughput_gflops": 150.63583686411107,
      "throughput_note": "host wall-clock; for simulated backends this is simulator speed, not device speed",
      "working_set_bytes": 131072,
      "workload": "gemm"
    },
    {
      "backend": "cuda",
      "reason": "no CUDA device visible to PyTorch on this host",
      "shape_mkn": [
        64,
        128,
        128
      ],
      "status": "skipped",
      "workload": "gemm"
    },
    {
      "backend": "awen-reference",
      "compile": {
        "mean_ms": 0.6639464489126112,
        "median_ci95_ms": [
          0.6291460013017058,
          0.661204809875926
        ],
        "min_ms": 0.6138989992905408,
        "p50_ms": 0.6437980009650346,
        "p95_ms": 0.7291990510566394,
        "p99_ms": 0.9227566049230514,
        "run_median_ci95_ms": [
          0.6437980009650346,
          0.6437980009650346
        ],
        "run_median_mean_ms": 0.6437980009650346,
        "runs": 1,
        "samples": 20
      },
      "fidelity": "software reference (exact math)",
      "latency": {
        "mean_ms": 1.2520532802591333,
        "median_ci95_ms": [
          1.2500719967647456,
          1.3078270058031194
        ],
        "min_ms": 0.9866010004770942,
        "p50_ms": 1.270560998818837,
        "p95_ms": 1.5172905474173604,
        "p99_ms": 1.5589500869828044,
        "run_median_ci95_ms": [
          1.154450599278789,
          1.3649732994963415
        ],
        "run_median_mean_ms": 1.2675477002630942,
        "runs": 5,
        "samples": 100
      },
      "process_max_rss_mib": 239.41796875,
      "relative_rms_error_vs_fp64": {
        "max": 6.382795045414222e-09,
        "mean": 6.3827950454142215e-09
      },
      "shape_mkn": [
        64,
        128,
        128
      ],
      "status": "ok",
      "throughput_gflops": 1.6505716781402815,
      "throughput_note": "host wall-clock; for simulated backends this is simulator speed, not device speed",
      "working_set_bytes": 131072,
      "workload": "gemm"
    },
    {
      "backend": "photonic-sim",
      "compile": {
        "mean_ms": 0.7951709489134373,
        "median_ci95_ms": [
          0.7644599972991273,
          0.8461585020995699
        ],
        "min_ms": 0.689421001879964,
        "p50_ms": 0.7951954976306297,
        "p95_ms": 0.8931476997531718,
        "p99_ms": 0.9102279395301592,
        "run_median_ci95_ms": [
          0.7951954976306297,
          0.7951954976306297
        ],
        "run_median_mean_ms": 0.7951954976306297,
        "runs": 1,
        "samples": 20
      },
      "fidelity": "simulated (compact model)",
      "latency": {
        "mean_ms": 2.387093600045773,
        "median_ci95_ms": [
          2.176538502681069,
          2.2895475012774114
        ],
        "min_ms": 2.026250003837049,
        "p50_ms": 2.2442970002884977,
        "p95_ms": 3.4028144975309256,
        "p99_ms": 4.314585285537761,
        "run_median_ci95_ms": [
          2.1440119024191517,
          2.3203197997645475
        ],
        "run_median_mean_ms": 2.222783101024106,
        "runs": 5,
        "samples": 100
      },
      "process_max_rss_mib": 240.1328125,
      "relative_rms_error_vs_fp64": {
        "max": 0.1682986786832978,
        "mean": 0.16650896781669194
      },
      "shape_mkn": [
        64,
        128,
        128
      ],
      "status": "ok",
      "throughput_gflops": 0.9344360393167291,
      "throughput_note": "host wall-clock; for simulated backends this is simulator speed, not device speed",
      "working_set_bytes": 131072,
      "workload": "gemm"
    },
    {
      "backend": "cpu",
      "fidelity": "measured",
      "latency": {
        "mean_ms": 0.023827089898986742,
        "median_ci95_ms": [
          0.020355000742711127,
          0.02211199898738414
        ],
        "min_ms": 0.01730499934637919,
        "p50_ms": 0.021534498955588788,
        "p95_ms": 0.03695875529956537,
        "p99_ms": 0.10240768031508196,
        "run_median_ci95_ms": [
          0.0191696010006126,
          0.024251500144600868
        ],
        "run_median_mean_ms": 0.02156370028387755,
        "runs": 5,
        "samples": 100
      },
      "process_max_rss_mib": 245.01953125,
      "relative_rms_error_vs_fp64": {
        "max": 6.81621307847825e-08,
        "mean": 6.81621307847825e-08
      },
      "shape_mkn": [
        128,
        256,
        256
      ],
      "status": "ok",
      "throughput_gflops": 779.0855052908421,
      "throughput_note": "host wall-clock; for simulated backends this is simulator speed, not device speed",
      "working_set_bytes": 524288,
      "workload": "gemm"
    },
    {
      "backend": "cuda",
      "reason": "no CUDA device visible to PyTorch on this host",
      "shape_mkn": [
        128,
        256,
        256
      ],
      "status": "skipped",
      "workload": "gemm"
    },
    {
      "backend": "awen-reference",
      "compile": {
        "mean_ms": 0.7226954996440327,
        "median_ci95_ms": [
          0.6580940025742166,
          0.7532484996772837
        ],
        "min_ms": 0.6136759984656237,
        "p50_ms": 0.6934980010555591,
        "p95_ms": 0.8367072452529102,
        "p99_ms": 1.033839845549664,
        "run_median_ci95_ms": [
          0.6934980010555591,
          0.6934980010555591
        ],
        "run_median_mean_ms": 0.6934980010555591,
        "runs": 1,
        "samples": 20
      },
      "fidelity": "software reference (exact math)",
      "latency": {
        "mean_ms": 10.98033196045435,
        "median_ci95_ms": [
          9.264946005714592,
          10.421364000649191
        ],
        "min_ms": 7.8189190026023425,
        "p50_ms": 9.958213500794955,
        "p95_ms": 16.18982469844923,
        "p99_ms": 17.30998677361649,
        "run_median_ci95_ms": [
          9.225058700394584,
          10.965732201293577
        ],
        "run_median_mean_ms": 9.975102500902722,
        "runs": 5,
        "samples": 100
      },
      "process_max_rss_mib": 245.01953125,
      "relative_rms_error_vs_fp64": {
        "max": 5.960945204640898e-09,
        "mean": 5.960945204640897e-09
      },
      "shape_mkn": [
        128,
        256,
        256
      ],
      "status": "ok",
      "throughput_gflops": 1.6847616290472875,
      "throughput_note": "host wall-clock; for simulated backends this is simulator speed, not device speed",
      "working_set_bytes": 524288,
      "workload": "gemm"
    },
    {
      "backend": "photonic-sim",
      "compile": {
        "mean_ms": 0.6929455506906379,
        "median_ci95_ms": [
          0.6343759996525478,
          0.7118935027392581
        ],
        "min_ms": 0.6129480025265366,
        "p50_ms": 0.6686220003757626,
        "p95_ms": 0.837673397472827,
        "p99_ms": 0.9727314799965823,
        "run_median_ci95_ms": [
          0.6686220003757626,
          0.6686220003757626
        ],
        "run_median_mean_ms": 0.6686220003757626,
        "runs": 1,
        "samples": 20
      },
      "fidelity": "simulated (compact model)",
      "latency": {
        "mean_ms": 20.395615530069335,
        "median_ci95_ms": [
          19.687235999299446,
          20.847460535151185
        ],
        "min_ms": 15.45311299560126,
        "p50_ms": 20.13117900060024,
        "p95_ms": 24.716483899464947,
        "p99_ms": 24.911422071381825,
        "run_median_ci95_ms": [
          19.096500700106844,
          20.982049599842867
        ],
        "run_median_mean_ms": 19.948740499967244,
        "runs": 5,
        "samples": 100
      },
      "process_max_rss_mib": 245.01953125,
      "relative_rms_error_vs_fp64": {
        "max": 0.15764790936295298,
        "mean": 0.15716488458780736
      },
      "shape_mkn": [
        128,
        256,
        256
      ],
      "status": "ok",
      "throughput_gflops": 0.8333946064212018,
      "throughput_note": "host wall-clock; for simulated backends this is simulator speed, not device speed",
      "working_set_bytes": 524288,
      "workload": "gemm"
    },
    {
      "backend": "cpu",
      "fidelity": "measured",
      "latency": {
        "mean_ms": 0.3698852696834365,